{
  "schema_version": "2.0",
  "course_type": "group",
  "group_name": "October 2026 Multi-PDF Shared Course",
  "group_id": "oct-2026-multi-pdf",
  "students": [
    {
      "schema_version": "2.0",
      "course_type": "individual",
      "season": "Summer 2026",
      "student": {
        "student_name": "Rami Khoury",
        "student_id": "TP-2026-0121",
        "grade_level": 11,
        "known_foundational_gaps": []
      },
      "scores": {
        "score_source": "provided",
        "reading_writing_scaled": 560,
        "math_scaled": 580,
        "total_scaled": 1140
      },
      "goal": {
        "target_sat_score": 1420,
        "intended_test_date": "2026-10-03"
      },
      "availability": {
        "weeks_available": 10,
        "preferred_sessions_per_week": 2,
        "max_session_length": "2 hrs",
        "session_format": "Focused blocks",
        "accommodation": "No"
      },
      "diagnostic": {
        "template_id": "Diagnostic_Exam_2026",
        "date": "2026-07-06",
        "answers": [
          {
            "section": "english",
            "module": "module_1",
            "question_number": 1,
            "student_answer": "C",
            "correct_answer": "A",
            "time_seconds": 95,
            "difficulty": "easy"
          },
          {
            "section": "english",
            "module": "module_1",
            "question_number": 2,
            "student_answer": "C",
            "correct_answer": "A",
            "time_seconds": 46,
            "difficulty": "easy"
          },
          {
            "section": "english",
            "module": "module_1",
            "question_number": 3,
            "student_answer": "D",
            "correct_answer": "A",
            "time_seconds": 73,
            "difficulty": "medium"
          },
          {
            "section": "english",
            "module": "module_1",
            "question_number": 4,
            "student_answer": "B",
            "correct_answer": "B",
            "time_seconds": 77,
            "difficulty": "medium"
          },
          {
            "section": "english",
            "module": "module_1",
            "question_number": 5,
            "student_answer": "D",
            "correct_answer": "D",
            "time_seconds": 67,
            "difficulty": "hard"
          },
          {
            "section": "english",
            "module": "module_1",
            "question_number": 6,
            "student_answer": "D",
            "correct_answer": "B",
            "time_seconds": 70,
            "difficulty": "medium"
          },
          {
            "section": "english",
            "module": "module_1",
            "question_number": 7,
            "student_answer": "A",
            "correct_answer": "A",
            "time_seconds": 90,
            "difficulty": "hard"
          },
          {
            "section": "english",
            "module": "module_1",
            "question_number": 8,
            "student_answer": "B",
            "correct_answer": "B",
            "time_seconds": 98,
            "difficulty": "easy"
          },
          {
            "section": "english",
            "module": "module_1",
            "question_number": 9,
            "student_answer": "A",
            "correct_answer": "A",
            "time_seconds": 69,
            "difficulty": "hard"
          },
          {
            "section": "english",
            "module": "module_1",
            "question_number": 10,
            "student_answer": "A",
            "correct_answer": "A",
            "time_seconds": 78,
            "difficulty": "medium"
          },
          {
            "section": "english",
            "module": "module_1",
            "question_number": 11,
            "student_answer": "D",
            "correct_answer": "D",
            "time_seconds": 77,
            "difficulty": "medium"
          },
          {
            "section": "english",
            "module": "module_1",
            "question_number": 12,
            "student_answer": "D",
            "correct_answer": "D",
            "time_seconds": 76,
            "difficulty": "easy"
          },
          {
            "section": "english",
            "module": "module_1",
            "question_number": 13,
            "student_answer": "B",
            "correct_answer": "B",
            "time_seconds": 72,
            "difficulty": "hard"
          },
          {
            "section": "english",
            "module": "module_1",
            "question_number": 14,
            "student_answer": "C",
            "correct_answer": "C",
            "time_seconds": 52,
            "difficulty": "easy"
          },
          {
            "section": "english",
            "module": "module_1",
            "question_number": 15,
            "student_answer": "D",
            "correct_answer": "D",
            "time_seconds": 65,
            "difficulty": "easy"
          },
          {
            "section": "english",
            "module": "module_1",
            "question_number": 16,
            "student_answer": "D",
            "correct_answer": "D",
            "time_seconds": 53,
            "difficulty": "medium"
          },
          {
            "section": "english",
            "module": "module_1",
            "question_number": 17,
            "student_answer": "D",
            "correct_answer": "B",
            "time_seconds": 71,
            "difficulty": "medium"
          },
          {
            "section": "english",
            "module": "module_1",
            "question_number": 18,
            "student_answer": "A",
            "correct_answer": "A",
            "time_seconds": 53,
            "difficulty": "hard"
          },
          {
            "section": "english",
            "module": "module_1",
            "question_number": 19,
            "student_answer": "A",
            "correct_answer": "A",
            "time_seconds": 86,
            "difficulty": "hard"
          },
          {
            "section": "english",
            "module": "module_1",
            "question_number": 20,
            "student_answer": "A",
            "correct_answer": "A",
            "time_seconds": 85,
            "difficulty": "hard"
          },
          {
            "section": "english",
            "module": "module_1",
            "question_number": 21,
            "student_answer": "D",
            "correct_answer": "D",
            "time_seconds": 66,
            "difficulty": "easy"
          },
          {
            "section": "english",
            "module": "module_1",
            "question_number": 22,
            "student_answer": "A",
            "correct_answer": "C",
            "time_seconds": 70,
            "difficulty": "medium"
          },
          {
            "section": "english",
            "module": "module_1",
            "question_number": 23,
            "student_answer": "A",
            "correct_answer": "D",
            "time_seconds": 93,
            "difficulty": "easy"
          },
          {
            "section": "english",
            "module": "module_1",
            "question_number": 24,
            "student_answer": "A",
            "correct_answer": "A",
            "time_seconds": 96,
            "difficulty": "medium"
          },
          {
            "section": "english",
            "module": "module_1",
            "question_number": 25,
            "student_answer": "C",
            "correct_answer": "C",
            "time_seconds": 46,
            "difficulty": "medium"
          },
          {
            "section": "english",
            "module": "module_1",
            "question_number": 26,
            "student_answer": "A",
            "correct_answer": "B",
            "time_seconds": 55,
            "difficulty": "hard"
          },
          {
            "section": "english",
            "module": "module_1",
            "question_number": 27,
            "student_answer": "A",
            "correct_answer": "C",
            "time_seconds": 62,
            "difficulty": "hard"
          },
          {
            "section": "english",
            "module": "module_b",
            "question_number": 1,
            "student_answer": "B",
            "correct_answer": "B",
            "time_seconds": 92,
            "difficulty": "medium"
          },
          {
            "section": "english",
            "module": "module_b",
            "question_number": 2,
            "student_answer": "A",
            "correct_answer": "A",
            "time_seconds": 82,
            "difficulty": "hard"
          },
          {
            "section": "english",
            "module": "module_b",
            "question_number": 3,
            "student_answer": "B",
            "correct_answer": "B",
            "time_seconds": 73,
            "difficulty": "hard"
          },
          {
            "section": "english",
            "module": "module_b",
            "question_number": 4,
            "student_answer": "B",
            "correct_answer": "B",
            "time_seconds": 65,
            "difficulty": "hard"
          },
          {
            "section": "english",
            "module": "module_b",
            "question_number": 5,
            "student_answer": "B",
            "correct_answer": "B",
            "time_seconds": 91,
            "difficulty": "medium"
          },
          {
            "section": "english",
            "module": "module_b",
            "question_number": 6,
            "student_answer": "D",
            "correct_answer": "D",
            "time_seconds": 82,
            "difficulty": "hard"
          },
          {
            "section": "english",
            "module": "module_b",
            "question_number": 7,
            "student_answer": "C",
            "correct_answer": "C",
            "time_seconds": 85,
            "difficulty": "hard"
          },
          {